{
  "schema_version": "1.0",
  "pathway_id": "power-iteration-p2-computer-science-v1-revision-v1",
  "condition": "P2",
  "plan_status": "provisional",
  "topic": "power iteration",
  "source_authorities": {
    "reference_contract": {"contract_id":"power-iteration","contract_version":"1.0.0","file":"experiments/rq1/reference-contracts/power-iteration-v1/release/frozen_reference_contract.json","sha256":"3c749a34a0bc3d1bacd3022a8e403c4f6b090afcd99359245d51987db45e2ce7"},
    "curriculum_model": {"model_id":"power-iteration-dependencies-v2","file":"curriculum-models/power-iteration-v1/release/frozen-contract-dependencies.json","sha256":"9952915a368244e7110233a06d9976ba76e6ff4f9a702886ff0db20b33170ee6","release_report_file":"curriculum-models/power-iteration-v1/release/curriculum-release-report.json","release_report_sha256":"00cb1d50225b2c7120a3abb0475968f2af63b2099b7630cc1f8b5e9c12f95bf6"}
  },
  "profile_binding": {"profile_id":"computer-science-year-2-rq2-pilot","file":"experiments/rq2/profiles/computer-science-year-2.json","sha256":"8a2dba4d066785775f1c70169a8c18d84049c7eb65612dff8008a7a63c78dd50"},
  "profile_concept_assessment_binding": {"artifact_id":"computer-science-year-2-concept-assessment-v2","file":"experiments/rq2/pathway-plans/power-iteration-v1/p2/computer-science/run-02/profile-concept-assessment.json","sha256":"268c42845243fc6a86e1a78e9c5b619b3eb3e1f6c5710ad868d7474b2ab24375"},
  "learning_request_binding": {"request_id":"power-iteration-second-year-v1","request_version":"1.0.0","file":"experiments/rq2/learning-requests/power-iteration-second-year.json","sha256":"c4cf0c6a4cf53653abab28123b4649dfd6459d894d3f85a310af0200468fe431"},
  "baseline_pathway_binding": {"pathway_id":"power-iteration-p0-v1","file":"experiments/rq2/pathway-plans/power-iteration-v1/p0/pathway-plan.json","sha256":"9cf1f1125924467e0bae738180bfdc2df0663dab56316caf849037dcacbe5480"},
  "selection_authority": "dependency_aware_planner",
  "selection": {
    "all_contract_item_ids":["RC-001","RC-002","RC-003","RC-004","RC-005","RC-006","RC-007","RC-008","RC-009","RC-010","RC-011","RC-012","RC-013","RC-014","RC-015","RC-016","RC-017","RC-018"],
    "selected_item_ids":["RC-001","RC-003","RC-004","RC-005","RC-006","RC-007","RC-008","RC-009","RC-010","RC-011","RC-012","RC-013","RC-014","RC-015","RC-016","RC-017","RC-018"],
    "excluded_item_ids":["RC-002"],
    "decisions":[
      {"item_id":"RC-001","decision":"include","selected_role":"supporting","rationale":"Retain the eigenpair definition as the invariant foundation for the algorithm and its implementation.","profile_basis":[{"profile_field":"prior_knowledge","evidence":"matrices and vectors support a concise definition-first treatment"}]},
      {"item_id":"RC-002","decision":"exclude","selected_role":null,"rationale":"Exclude the characteristic-polynomial route to prioritise executable matrix-vector computation; RC-018 uses its allowed local fallback.","profile_basis":[{"profile_field":"prior_knowledge","evidence":"Python/NumPy and basic algorithm analysis"},{"profile_field":"preferred_representations","evidence":"pseudocode, iteration invariants, and complexity"}]},
      {"item_id":"RC-003","decision":"include","selected_role":"supporting","rationale":"Keep the symmetric spectral setting because it supplies the Contract's valid convergence explanation and projection coordinates.","profile_basis":[{"profile_field":"prior_knowledge","evidence":"vectors and matrices"}]},
      {"item_id":"RC-004","decision":"include","selected_role":"supporting","rationale":"Retain the strict dominant-magnitude assumption so algorithmic convergence claims remain conditional and auditable.","profile_basis":[{"profile_field":"authentic_context_boundary","evidence":"Ranking or spectral-computation examples require their assumptions to be stated; RC-004 keeps convergence claims conditional and prevents the computational pathway from presenting power iteration as universally convergent."}]},
      {"item_id":"RC-005","decision":"include","selected_role":"target","rationale":"Make the normalized matrix-vector update the central computational target for this computer-science pathway.","profile_basis":[{"profile_field":"prior_knowledge","evidence":"Python/NumPy"},{"profile_field":"preferred_representations","evidence":"pseudocode"}]},
      {"item_id":"RC-006","decision":"include","selected_role":"supporting","rationale":"Retain the dominant-component explanation, but present it through a discrete coefficient-ratio or iteration-invariant account rather than an assumed calculus-based convergence proof.","profile_basis":[{"profile_field":"prior_knowledge","evidence":"vectors and matrices"},{"profile_field":"missing_or_fragile_prerequisites","evidence":"calculus-based convergence arguments are missing or fragile; use a discrete coefficient-ratio or iteration-invariant explanation instead of assuming a calculus-based proof"}]},
      {"item_id":"RC-007","decision":"include","selected_role":"target","rationale":"Required convergence limitations should be interpreted using the spectral-gap ratio rather than asserted unconditionally.","profile_basis":[{"profile_field":"preferred_representations","evidence":"complexity and stopping criteria"}]},
      {"item_id":"RC-008","decision":"include","selected_role":"supporting","rationale":"Keep sign alternation as an implementation-relevant interpretation of iterates and residual-based stopping.","profile_basis":[{"profile_field":"preferred_representations","evidence":"iteration invariants and stopping criteria"}]},
      {"item_id":"RC-009","decision":"include","selected_role":"target","rationale":"The Rayleigh estimate is needed to connect matrix computation to an approximate eigenvalue.","profile_basis":[{"profile_field":"preferred_representations","evidence":"stopping criteria"}]},
      {"item_id":"RC-010","decision":"include","selected_role":"target","rationale":"The residual norm is the preferred operational quality and stopping measure for the implementation.","profile_basis":[{"profile_field":"preferred_representations","evidence":"complexity and stopping criteria"}]},
      {"item_id":"RC-011","decision":"include","selected_role":"target","rationale":"Retain the complete safeguarded algorithm, including breakdown, tolerance, and iteration-limit paths.","profile_basis":[{"profile_field":"prior_knowledge","evidence":"basic algorithm analysis"},{"profile_field":"preferred_representations","evidence":"pseudocode"}]},
      {"item_id":"RC-012","decision":"include","selected_role":"supporting","rationale":"Include the missing-projection failure condition as a precise limitation of the algorithm.","profile_basis":[{"profile_field":"preferred_representations","evidence":"iteration invariants"}]},
      {"item_id":"RC-013","decision":"include","selected_role":"target","rationale":"Include tied dominance and slow convergence because they directly affect complexity and stopping decisions.","profile_basis":[{"profile_field":"preferred_representations","evidence":"complexity and stopping criteria"}]},
      {"item_id":"RC-014","decision":"include","selected_role":"supporting","rationale":"Preserve the largest-magnitude target distinction to prevent a common implementation interpretation error.","profile_basis":[{"profile_field":"preferred_representations","evidence":"pseudocode and iteration invariants"}]},
      {"item_id":"RC-015","decision":"include","selected_role":"supporting","rationale":"State the symmetric-scope boundary before using the convergence explanation in computational examples.","profile_basis":[{"profile_field":"authentic_context_boundary","evidence":"ranking or spectral-computation examples require assumptions to be stated"}]},
      {"item_id":"RC-016","decision":"include","selected_role":"target","rationale":"Use the profile's NumPy background to emphasise input-shape and initial-vector safeguards.","profile_basis":[{"profile_field":"prior_knowledge","evidence":"Python/NumPy"}]},
      {"item_id":"RC-017","decision":"include","selected_role":"target","rationale":"Retain executable iteration semantics, exception ordering, residual stopping, and the four-value return contract.","profile_basis":[{"profile_field":"prior_knowledge","evidence":"Python/NumPy and basic algorithm analysis"},{"profile_field":"preferred_representations","evidence":"pseudocode and complexity"}]},
      {"item_id":"RC-018","decision":"include","selected_role":"target","rationale":"Use the worked result to consolidate tracing, estimate quality, and executable verification. Supply the exact eigenvalues as given, identify the example-specific dominant eigenvalue by a short local magnitude comparison, and check the dominant estimate and residual without deriving the characteristic polynomial or revisiting the general magnitude distinction.","profile_basis":[{"profile_field":"prior_knowledge","evidence":"Python/NumPy"},{"profile_field":"preferred_representations","evidence":"pseudocode and stopping criteria"}]}
    ]
  },
  "learning_goal_mappings":[
    {"capability_id":"LG-001","supporting_item_ids":["RC-001","RC-005","RC-011","RC-014","RC-017","RC-018"],"coverage":"complete","rationale":"RC-001 establishes the eigenpair objective and RC-014 clarifies the largest-magnitude target, while RC-005, RC-011, RC-017, and RC-018 provide the normalized update, algorithm, executable trace, and worked consolidation."},
    {"capability_id":"LG-002","supporting_item_ids":["RC-009","RC-010","RC-011","RC-017","RC-018"],"coverage":"complete","rationale":"Rayleigh estimation, residual quality, stopping logic, implementation, and the worked result provide complete approximate-eigenpair interpretation."},